{
  "timespan": "2018\n2020",
  "icon": "/personal-website-astro/assets/pwc_logo.png",
  "iconAlt": "Earlier Company",
  "title": "Full Stack Developer",
  "organization": "WebSolutions",
  "description": "I was a Full Stack Developer at WebSolutions, where I developed responsive web applications and RESTful APIs. I worked with a variety of technologies including React, Node.js, and MongoDB, and contributed to several key projects that improved user engagement and system performance."
}
