{
  "timespan": "2023",
  "icon": "/assets/amazon_logo.png",
  "iconAlt": "Amazon",
  "title": "Senior Software Engineer",
  "organization": "Tech Innovations",
  "description": "I'm currently working as a Senior Software Engineer at Tech Innovations, focusing on developing AI-powered solutions for enterprise clients.",
  "links": [
    {
      "text": "YouTube channel",
      "url": "https://youtube.com/example"
    }
  ],
  "items": [
    "Building Scalable Web Applications - A comprehensive guide to modern web architecture.",
    "Machine Learning Fundamentals - Introduction to key ML concepts and implementations.",
    "Cloud-Native Development - Best practices for developing applications in the cloud."
  ]
}
