{
  "timespan": "2011\n2014",
  "icon": "/assets/imperial_college_logo.png",
  "iconAlt": "Imperial College London",
  "title": "Bachelor's in Computer Science",
  "organization": "Imperial College London",
  "description": "Earned my Bachelor's degree with a focus on software engineering and data structures."
}
