{
  "timespan": "2014\n2016",
  "icon": "/assets/padua_university_logo.png",
  "iconAlt": "University of Padua",
  "title": "Master's in Computer Science",
  "organization": "University of Padua",
  "description": "Completed my Master's degree focusing on machine learning and artificial intelligence."
}
